[
  {
    "slug": "barangay-dolores",
    "barangay_name": "DOLORES",
    "address": "Mahinhin Cor. C. Valle St. Barangay Hall",
    "trunkline": ["0918 911 7046"],
    "website": "https://www.facebook.com/SmileDolores",
    "officials": [
      {
        "role": "Punong Barangay",
        "name": "REINER ANDREW SAMSON TOLENTINO PACLEB"
      },
      {
        "role": "SB Member",
        "name": "FRANCHESCA IJ C. PERSIA"
      },
      {
        "role": "SB Member",
        "name": "MA. TERESA M. ARRIOLA"
      },
      {
        "role": "SB Member",
        "name": "MICHELLE ANN D. POLICARPIO"
      },
      {
        "role": "SB Member",
        "name": "ESTREGAN P. CAYTON"
      },
      {
        "role": "SB Member",
        "name": "RONNIE B. DIZON"
      },
      {
        "role": "SB Member",
        "name": "CHRISTIAN CARLOS P. CRUZ"
      },
      {
        "role": "SB Member",
        "name": "MICHAEL A. CATAPUSAN"
      },
      {
        "role": "SK Chairperson",
        "name": "JAN CHLOE V. CRISOSTOMO"
      },
      {
        "role": "Barangay Secretary",
        "name": "PEARL JOY T. DEFANTE"
      },
      {
        "role": "SK Member",
        "name": "MARJORIE B. EJARES"
      },
      {
        "role": "SK Member",
        "name": "RENALYN JOY D.L NAÑOS"
      },
      {
        "role": "SK Secretary",
        "name": "ROSEMARIE A. ALCORIZA-GONZAGA"
      },
      {
        "role": "SK Treasurer",
        "name": "EVANZ RHYAN L. PAJANTOY"
      }
    ]
  },
  {
    "slug": "barangay-muzon",
    "barangay_name": "MUZON",
    "address": "National Road Cor. Dela Cuesta St. Barangay Hall",
    "trunkline": ["0955 527 9328"],
    "website": "https://www.facebook.com/SmileMuzon/",
    "officials": [
      {
        "role": "Punong Barangay",
        "name": "ANIEL C. CRUZ"
      },
      {
        "role": "SB Member",
        "name": "MICHAEL C. APAREJO"
      },
      {
        "role": "SB Member",
        "name": "TEODULO C. AGUINALDO"
      },
      {
        "role": "SB Member",
        "name": "GILBERT RYAN C. ESTRADA"
      },
      {
        "role": "SB Member",
        "name": "CRIZALDY V. IGNACIO"
      },
      {
        "role": "SB Member",
        "name": "CHRISTOPHER C. NAVARRO"
      },
      {
        "role": "SB Member",
        "name": "RODA MAY A. DIÑO"
      },
      {
        "role": "SB Member",
        "name": "YSMAEL D. BELEN"
      },
      {
        "role": "SK Chairperson",
        "name": "AERON GLENN B. SY"
      },
      {
        "role": "Barangay Secretary",
        "name": "LOURDES P. DISTOR"
      },
      {
        "role": "SK Member",
        "name": "JOHN OLCEN ACEBRON"
      },
      {
        "role": "SK Member",
        "name": "GENARD AGON"
      },
      {
        "role": "SK Member",
        "name": "RIYAN MAE DENIÑA"
      },
      {
        "role": "SK Member",
        "name": "ADRIEL DOLORES"
      },
      {
        "role": "SK Member",
        "name": "KURTHY COMPA"
      },
      {
        "role": "SK Member",
        "name": "KRISTINE ALOMIA"
      },
      {
        "role": "SK Member",
        "name": "LEINNOR SARANGAY"
      },
      {
        "role": "SK Secretary",
        "name": "ABEGAIL INGRID GUIVENCAN"
      },
      {
        "role": "SK Treasurer",
        "name": "LUKE GAERLAN"
      }
    ]
  },
  {
    "slug": "barangay-san-juan",
    "barangay_name": "SAN JUAN",
    "address": "Tanchoco Ave., El Monteverde Subd. Barangay Hall",
    "trunkline": ["0906 725 9232"],
    "website": "https://www.facebook.com/BSJTaytay/",
    "officials": [
      {
        "role": "Punong Barangay",
        "name": "ROSELLER ZABALA VALERA"
      },
      {
        "role": "SB Member",
        "name": "JANNAH ROA D. DAZO"
      },
      {
        "role": "SB Member",
        "name": "ALLAN T. DELA ROSA"
      },
      {
        "role": "SB Member",
        "name": "RICARDO D. CRUZ"
      },
      {
        "role": "SB Member",
        "name": "TOM JOSEPH M. BERMILLO"
      },
      {
        "role": "SB Member",
        "name": "JEANNE ANGELICA P. DOLORES"
      },
      {
        "role": "SB Member",
        "name": "ALFRED C. FRANCISCO"
      },
      {
        "role": "SK Chairperson",
        "name": "JANINAH OLIVIENNE D. MERCADO"
      },
      {
        "role": "Barangay Secretary",
        "name": "TEODULO M. REBLANDO JR"
      },
      {
        "role": "SK Member",
        "name": "JUNNIELYN CASITAS"
      },
      {
        "role": "SK Member",
        "name": "MAMAD PANDA"
      },
      {
        "role": "SK Member",
        "name": "GAB LUCAS"
      },
      {
        "role": "SK Member",
        "name": "JOHN RALPH MALQUEZ"
      },
      {
        "role": "SK Member",
        "name": "MAT NAVAL"
      },
      {
        "role": "SK Member",
        "name": "D-ANN DEL MONTE"
      },
      {
        "role": "SK Member",
        "name": "ARON GONZALES"
      },
      {
        "role": "SK Secretary",
        "name": "MAYMAY SALIVA"
      },
      {
        "role": "SK Treasurer",
        "name": "SITTIEHAYA MARANGIT"
      }
    ]
  },
  {
    "slug": "barangay-sta-ana",
    "barangay_name": "STA ANA",
    "address": "B.A. Cruz St., Tudela, Barangay Hall",
    "trunkline": ["0945 544 2954", "0919 254 4257"],
    "website": "https://www.facebook.com/BarangayStaAnaTR/",
    "officials": [
      {
        "role": "Punong Barangay",
        "name": "JEAN LALAINE P. CALDERON, U.A.P."
      },
      {
        "role": "SB Member",
        "name": "JERRY T. CALDERON"
      },
      {
        "role": "SB Member",
        "name": "ERICKSON Z. AQUINO"
      },
      {
        "role": "SB Member",
        "name": "ELLA VALARIE B. CAPUNO-GREGORIO"
      },
      {
        "role": "SB Member",
        "name": "JOSE TEDDY D. ANDRES"
      },
      {
        "role": "SB Member",
        "name": "ROBERT L. ALBERTO JR"
      },
      {
        "role": "SB Member",
        "name": "HILBERT B. BRIZ"
      },
      {
        "role": "SB Member",
        "name": "ARMANDO Z. DE LEON JR"
      },
      {
        "role": "SK Chairperson",
        "name": "LUCIA MARIE D. ALCANTARA"
      },
      {
        "role": "Barangay Secretary",
        "name": "JUSTINE P. TRANGIA"
      },
      {
        "role": "SK Member",
        "name": "ANGELICA M. BALUETA"
      },
      {
        "role": "SK Member",
        "name": "JERICHO D. NIMES"
      },
      {
        "role": "SK Member",
        "name": "SHANEL FAITH A. MENDOZA"
      },
      {
        "role": "SK Member",
        "name": "ISRAEL A. BELLO"
      },
      {
        "role": "SK Member",
        "name": "ERJAY P. DELA PAZ"
      },
      {
        "role": "SK Member",
        "name": "YNA ROSE L. CABIARA"
      },
      {
        "role": "SK Member",
        "name": "KRISTINA CASSANDRA D. BELLO"
      },
      {
        "role": "SK Secretary",
        "name": "RHABEN P. VILLAS"
      },
      {
        "role": "SK Treasurer",
        "name": "RONA MAY G. COLO"
      }
    ]
  },
  {
    "slug": "barangay-san-isidro",
    "barangay_name": "SAN ISIDRO",
    "address": "Noli Pascual St., Gregoria Heights Subd. Barangay Hall, Brgy. San Isidro",
    "trunkline": ["0995 679 2525"],
    "website": "https://www.facebook.com/bsi.taytayrizal/",
    "officials": [
      {
        "role": "Punong Barangay",
        "name": "VIVIAN R. YUPANGCO"
      },
      {
        "role": "SB Member",
        "name": "RAYMOND EMMANUEL ARCADIUS C. MANNING"
      },
      {
        "role": "SB Member",
        "name": "STEPHANIE EUNICE L. CABRAL-ISIG"
      },
      {
        "role": "SB Member",
        "name": "JUVI ARACELI D. HABACON-LAROZA"
      },
      {
        "role": "SB Member",
        "name": "ROBERT RYAN M. TOLENTINO"
      },
      {
        "role": "SB Member",
        "name": "ROSE LYNN S. ESGUERRA"
      },
      {
        "role": "SB Member",
        "name": "ALDIN B. GATAPIA"
      },
      {
        "role": "SB Member",
        "name": "ELIZABETH D. BALIWAG"
      },
      {
        "role": "SK Chairperson",
        "name": "JAN GERICK G. FRANCISCO"
      },
      {
        "role": "Barangay Secretary",
        "name": "DOLORES B. BERMUNDO"
      },
      {
        "role": "SK Member",
        "name": "TRYSHA DELA CRUZ"
      },
      {
        "role": "SK Member",
        "name": "DESIREE SUYAT"
      },
      {
        "role": "SK Member",
        "name": "KYLE ABUID"
      },
      {
        "role": "SK Member",
        "name": "AJ LEGASPI"
      },
      {
        "role": "SK Member",
        "name": "JT NAVAL"
      },
      {
        "role": "SK Member",
        "name": "MONIQUE CABLING"
      },
      {
        "role": "SK Member",
        "name": "AARON SUGUITAN"
      },
      {
        "role": "SK Secretary",
        "name": "HONEY CAMILLE C. AQUINO"
      },
      {
        "role": "SK Treasurer",
        "name": "ISAIAH FRANCISCO"
      }
    ]
  }
]
